{
  "schemaVersion": 1,
  "initialMapping": "H_MIRROR",
  "id": "level-009",
  "title": "先远离后返回",
  "chapter": 1,
  "order": 9,
  "grid": {
    "width": 5,
    "height": 5
  },
  "blueStart": {
    "x": 0,
    "y": 4
  },
  "orangeStart": {
    "x": 4,
    "y": 4
  },
  "blueExit": {
    "x": 0,
    "y": 0
  },
  "orangeExit": {
    "x": 4,
    "y": 0
  },
  "walls": [
    {
      "x": 0,
      "y": 1
    },
    {
      "x": 0,
      "y": 2
    },
    {
      "x": 0,
      "y": 3
    },
    {
      "x": 4,
      "y": 1
    },
    {
      "x": 4,
      "y": 2
    },
    {
      "x": 4,
      "y": 3
    },
    {
      "x": 2,
      "y": 0
    },
    {
      "x": 2,
      "y": 1
    },
    {
      "x": 2,
      "y": 2
    },
    {
      "x": 2,
      "y": 3
    },
    {
      "x": 2,
      "y": 4
    }
  ],
  "entities": [],
  "hint": {
    "focus": "蓝方的出口在上方，但左侧通道被墙堵住。必须先向右远离出口，绕到中央通道再向上，最后向左回到出口。"
  },
  "tags": ["chapter-1", "M0", "detour"],
  "parMoves": 6,
  "parMovesNote": "BFS 最短步数=6；parMoves 与求解器严格一致"
}
