{
  "schemaVersion": 1,
  "initialMapping": "H_MIRROR",
  "id": "level-006",
  "title": "允许对穿",
  "chapter": 1,
  "order": 6,
  "grid": {
    "width": 5,
    "height": 5
  },
  "blueStart": {
    "x": 0,
    "y": 4
  },
  "orangeStart": {
    "x": 4,
    "y": 4
  },
  "blueExit": {
    "x": 0,
    "y": 0
  },
  "orangeExit": {
    "x": 4,
    "y": 0
  },
  "walls": [
    { "x": 2, "y": 0 },
    { "x": 2, "y": 1 },
    { "x": 2, "y": 2 },
    { "x": 2, "y": 3 },
    { "x": 0, "y": 3 },
    { "x": 4, "y": 3 }
  ],
  "entities": [],
  "hint": {
    "focus": "蓝方从左边出发，橙方从右边出发。中途两人会在中央相遇——规则允许对穿交换位置，不必回避。"
  },
  "tags": ["chapter-1", "tutorial", "M0", "cross-through"],
  "parMoves": 6,
  "parMovesNote": "BFS 求解器验证最短步数=6"
}
