{
  "schemaVersion": 1,
  "initialMapping": "H_MIRROR",
  "id": "level-005",
  "title": "出口不锁定",
  "chapter": 1,
  "order": 5,
  "grid": {
    "width": 5,
    "height": 5
  },
  "blueStart": {
    "x": 0,
    "y": 4
  },
  "orangeStart": {
    "x": 4,
    "y": 4
  },
  "blueExit": {
    "x": 0,
    "y": 2
  },
  "orangeExit": {
    "x": 4,
    "y": 0
  },
  "walls": [
    {
      "x": 2,
      "y": 1
    },
    {
      "x": 2,
      "y": 2
    },
    {
      "x": 2,
      "y": 3
    },
    {
      "x": 4,
      "y": 2
    }
  ],
  "entities": [],
  "hint": {
    "focus": "蓝的出口很近，但橙需要绕远路：先到的人耐心等待"
  },
  "tags": ["chapter-1", "tutorial", "M0", "exit-no-lock"],
  "parMoves": 8,
  "parMovesNote": "BFS 最短步数=8"
}
