{
  "schemaVersion": 1,
  "initialMapping": "H_MIRROR",
  "id": "level-004",
  "title": "墙体解耦",
  "chapter": 1,
  "order": 4,
  "grid": {
    "width": 5,
    "height": 5
  },
  "blueStart": {
    "x": 0,
    "y": 4
  },
  "orangeStart": {
    "x": 4,
    "y": 4
  },
  "blueExit": {
    "x": 0,
    "y": 0
  },
  "orangeExit": {
    "x": 4,
    "y": 0
  },
  "walls": [
    { "x": 2, "y": 0 },
    { "x": 2, "y": 1 },
    { "x": 2, "y": 2 },
    { "x": 2, "y": 3 },
    { "x": 2, "y": 4 },
    { "x": 0, "y": 2 },
    { "x": 4, "y": 2 }
  ],
  "entities": [],
  "hint": {
    "focus": "中央一列墙把棋盘分成左右两半，蓝方出口在左上角，橙方在右上角。注意蓝方和橙方在水平方向上镜像移动：按右时蓝向右、橙向左。"
  },
  "tags": ["chapter-1", "tutorial", "M0", "wall-decouple"],
  "parMoves": 6,
  "parMovesNote": "BFS 求解器验证最短步数=6"
}