{
  "schemaVersion": 1,
  "id": "level-007",
  "chapter": 1,
  "order": 7,
  "title": "两次解耦",
  "initialMapping": "H_MIRROR",
  "grid": {
    "width": 6,
    "height": 5
  },
  "blueStart": {
    "x": 5,
    "y": 4
  },
  "orangeStart": {
    "x": 0,
    "y": 4
  },
  "blueExit": {
    "x": 5,
    "y": 0
  },
  "orangeExit": {
    "x": 0,
    "y": 0
  },
  "walls": [
    {
      "x": 3,
      "y": 0
    },
    {
      "x": 3,
      "y": 1
    },
    {
      "x": 3,
      "y": 2
    },
    {
      "x": 3,
      "y": 3
    },
    {
      "x": 2,
      "y": 1
    },
    {
      "x": 2,
      "y": 2
    },
    {
      "x": 2,
      "y": 3
    },
    {
      "x": 2,
      "y": 4
    },
    {
      "x": 5,
      "y": 2
    },
    {
      "x": 0,
      "y": 2
    }
  ],
  "entities": [],
  "parMoves": 6,
  "parMovesNote": "BFS 最短步数=6；parMoves 与求解器严格一致",
  "hint": {
    "focus": "蓝橙起手侧对调了。两道错开的墙仍需要两次解耦，但左右绕行顺序与上一版相反。"
  },
  "tags": ["chapter-1", "M0", "double-decouple", "route-variation"]
}
