{
  "schemaVersion": 1,
  "initialMapping": "H_MIRROR",
  "id": "level-010",
  "title": "第一章综合",
  "chapter": 1,
  "order": 10,
  "grid": {
    "width": 5,
    "height": 5
  },
  "blueStart": {
    "x": 0,
    "y": 4
  },
  "orangeStart": {
    "x": 4,
    "y": 4
  },
  "blueExit": {
    "x": 0,
    "y": 0
  },
  "orangeExit": {
    "x": 4,
    "y": 0
  },
  "walls": [
    {
      "x": 0,
      "y": 2
    },
    {
      "x": 1,
      "y": 2
    }
  ],
  "entities": [],
  "hint": {
    "focus": "章末挑战：先让橙直线上行，再让蓝绕过横墙；观察每次受阻带来的错位。"
  },
  "tags": ["chapter-1", "M0", "chapter-final"],
  "parMoves": 9,
  "parMovesNote": "BFS 最短步数=9；parMoves 与求解器严格一致"
}
