{
  "schemaVersion": 1,
  "id": "level-008",
  "chapter": 1,
  "order": 8,
  "title": "折线预演",
  "initialMapping": "H_MIRROR",
  "grid": {
    "width": 6,
    "height": 6
  },
  "blueStart": {
    "x": 0,
    "y": 5
  },
  "orangeStart": {
    "x": 5,
    "y": 5
  },
  "blueExit": {
    "x": 2,
    "y": 0
  },
  "orangeExit": {
    "x": 3,
    "y": 0
  },
  "walls": [
    {
      "x": 2,
      "y": 2
    },
    {
      "x": 3,
      "y": 2
    },
    {
      "x": 2,
      "y": 3
    },
    {
      "x": 3,
      "y": 3
    },
    {
      "x": 0,
      "y": 3
    },
    {
      "x": 5,
      "y": 3
    },
    {
      "x": 0,
      "y": 1
    },
    {
      "x": 5,
      "y": 1
    }
  ],
  "entities": [],
  "parMoves": 7,
  "parMovesNote": "BFS 最短步数=7；parMoves 与求解器严格一致",
  "hint": {
    "focus": "先看两侧缺口，再规划折线路线；墙会在不同回合分别挡住两人。"
  },
  "tags": ["chapter-1", "M0", "asymmetric", "pre-final"]
}
